{
  "$schema": "../config.schema.json",
  "version": 2,
  "applications": {
    "parcel": {
      "integrationMode": "parcel",
      "route": "/route",
      "entry": {
        "html": "index.html",
        "scripts": ["asd"]
      }
    }
  },
  "importmap": {
    "imports": {
      "a": "/a-1.mjs",
      "b": "/b-1.mjs",
      "c": "/c-1.mjs"
    },
    "scopes": {
      "/scope2/": {
        "a": "/a-2.mjs"
      },
      "/scope2/scope3/": {
        "b": "/b-3.mjs"
      }
    }
  },
  "layout": {
    "sources": "banana",
    "content": [
      {
        "tag": "div",
        "attributes": {
          "style": "padding: 0;"
        },
        "content": "Hello!"
      },
      {
        "tag": "slot"
      }
    ]
  }
}
